{
  "id": "SESS-DEMO-001",
  "capsule_id": "CAP-RIVIERES",
  "capsule_version": "0.1-demo",
  "state": "brouillon",
  "participants": [
    "P-001",
    "P-002",
    "P-003",
    "P-004",
    "P-005",
    "P-006",
    "P-007",
    "P-008",
    "P-009",
    "P-010",
    "P-011",
    "P-012",
    "P-013",
    "P-014",
    "P-015",
    "P-016",
    "P-017",
    "P-018",
    "P-019",
    "P-020"
  ],
  "assignment_mode": "tiers_choix",
  "content_versions": {
    "KR-ARCHIVES": "0.1-demo",
    "KR-PERSPECTIVES": "0.1-demo"
  },
  "teacher_approval": false,
  "version": 0,
  "phase_id": "exploration"
}
